{
    "meta": {
        "protocol_version": "1.0.0",
        "schema_version": "1.0.0",
        "created_at": "2025-01-01T00:00:00.000Z"
    },
    "role_id": "550e8400-e29b-41d4-a716-446655440000",
    "name": "test_agent",
    "events": [
        {
            "event_id": "550e8400-e29b-41d4-a716-446655440200",
            "event_type": "role.assigned",
            "source": "role",
            "timestamp": "2025-01-01T00:00:00.000Z"
        }
    ]
}